{
  "type": "supply",
  "version": 1,
  "id": "9f3c1a2e-7b41-4c8e-9d2a-51f08c77b3aa",
  "name": "Pink Kush",
  "shortName": "pink",
  "variety": "indica",
  "terpenes": [
    {
      "name": "Myrcene",
      "percentage": 0.8
    },
    {
      "name": "Caryophyllene",
      "percentage": 0.4
    }
  ],
  "totalTerpenes": 2.1,
  "grams": 2.1,
  "gramsStart": 3.5,
  "cost": 29.99,
  "currency": "CAD",
  "taxes": [
    "5a6b7c8d-9e0f-4a1b-8c2d-3e4f5a6b7c8d",
    "6b7c8d9e-0f1a-4b2c-8d3e-4f5a6b7c8d9e"
  ],
  "purchased": "2026-07-02T18:05:00.000-07:00",
  "packaged": "2026-05-14T00:00:00.000-07:00",
  "expiry": "2027-07-02T18:05:00.000-07:00",
  "shop": "2b3c4d5e-6f7a-4b8c-9d0e-1f2a3b4c5d6e",
  "brand": "4d6f8a2b-1c3e-4f5a-9b8c-7d6e5f4a3b2c",
  "rating": 4,
  "photo": "sha256:235179b754802f1dcde8607cfbf69330f2ef07fc53e9f3fde45f601e127dfab3",
  "lowThreshold": 1.0,
  "finished": false,
  "favorite": true,
  "sharedSupply": false,
  "created": "2026-07-02T18:05:00-07:00",
  "updated": "2026-07-09T21:44:00-07:00",
  "notes": "Dense buds, gassy. Better in the bong than rolled.\nSecond time buying \u2014 first batch was drier.",
  "cannabinoids": [
    {
      "name": "THC",
      "asSoldMgPerGram": 8,
      "totalMgPerGram": 225
    },
    {
      "name": "CBD",
      "asSoldMgPerGram": 0.1,
      "totalMgPerGram": 1
    },
    {
      "name": "CBG",
      "totalMgPerGram": 12
    }
  ],
  "cultivar": "Pink Kush",
  "lineage": "OG Kush lineage",
  "tip": 2,
  "receiptNumber": "000042-A"
}
